{
  "$schema": "./schema/hulls.schema.json",
  "version": "1.0",
  "notes": [
    "Четыре типа слотов: weapon, defense, propulsion, utility.",
    "Реакторы, трюмы, сенсоры, топливные баки, десантные отсеки — всё в utility.",
    "Это намеренно: больше энергии означает меньше трюма, и наоборот.",
    "crewCapacity — потолок экипажа; каждый модуль требует людей. Не хватает — проект невалиден.",
    "Скорость не является характеристикой корпуса: она равна суммарной тяге, делённой на",
    "суммарную массу, то есть выводится из проекта (решение №10)."
  ],

  "slotTypes": ["weapon", "defense", "propulsion", "utility"],

  "hulls": [
    {
      "id": "shuttle",
      "name": "Шаттл",
      "tier": 1,
      "class": "civilian",
      "phase": 1,
      "slots": { "weapon": 0, "defense": 0, "propulsion": 1, "utility": 2 },
      "baseMass": 35,
      "structure": 50,
      "crewCapacity": 10,
      "baseFuel": 60,
      "buildRecipe": { "hull_frames": 1, "life_support": 1 },
      "buildDays": 8,
      "tech": "start"
    },
    {
      "id": "corvette",
      "name": "Корвет",
      "tier": 1,
      "class": "warship",
      "phase": 1,
      "slots": { "weapon": 2, "defense": 1, "propulsion": 2, "utility": 1 },
      "baseMass": 55,
      "structure": 110,
      "crewCapacity": 22,
      "baseFuel": 80,
      "buildRecipe": { "hull_frames": 2, "alloys": 4, "life_support": 1 },
      "buildDays": 12,
      "tech": "start"
    },
    {
      "id": "freighter",
      "name": "Грузовик",
      "tier": 1,
      "class": "civilian",
      "phase": 1,
      "slots": { "weapon": 0, "defense": 1, "propulsion": 2, "utility": 6 },
      "baseMass": 160,
      "structure": 220,
      "crewCapacity": 30,
      "baseFuel": 140,
      "buildRecipe": { "hull_frames": 3, "alloys": 5, "life_support": 2 },
      "buildDays": 16,
      "tech": "start"
    },
    {
      "id": "prospector",
      "name": "Изыскатель",
      "tier": 1,
      "class": "civilian",
      "phase": 1,
      "slots": { "weapon": 0, "defense": 1, "propulsion": 2, "utility": 4 },
      "baseMass": 110,
      "structure": 160,
      "crewCapacity": 26,
      "baseFuel": 120,
      "buildRecipe": { "hull_frames": 2, "alloys": 4, "life_support": 2 },
      "buildDays": 14,
      "tech": "start"
    },
    {
      "id": "frigate",
      "name": "Фрегат",
      "tier": 2,
      "class": "warship",
      "phase": 1,
      "slots": { "weapon": 3, "defense": 2, "propulsion": 2, "utility": 2 },
      "baseMass": 120,
      "structure": 250,
      "crewCapacity": 46,
      "baseFuel": 110,
      "buildRecipe": { "hull_frames": 4, "alloys": 8, "life_support": 2 },
      "buildDays": 22,
      "tech": "hull_frigate"
    },
    {
      "id": "gunship",
      "name": "Канонерка",
      "tier": 2,
      "class": "warship",
      "phase": 1,
      "slots": { "weapon": 4, "defense": 1, "propulsion": 2, "utility": 1 },
      "baseMass": 100,
      "structure": 180,
      "crewCapacity": 40,
      "baseFuel": 90,
      "buildRecipe": { "hull_frames": 3, "alloys": 6, "life_support": 1 },
      "buildDays": 18,
      "tech": "hull_gunship",
      "comment": "Расширение v1.1. Заполняет разрыв между корветом и фрегатом: максимум орудий за деньги ценой почти полного отсутствия защиты, одного утилитарного слота (то есть одного реактора) и малого запаса хода. Проверка на роль: у фрегата 3 орудия при 2 защитных слотах, у канонерки 4 при 1 — она не доминирует, а занимает свободный угол пространства проектов."
    },
    {
      "id": "heavy_freighter",
      "name": "Тяжёлый грузовик",
      "tier": 2,
      "class": "civilian",
      "phase": 1,
      "slots": { "weapon": 0, "defense": 2, "propulsion": 3, "utility": 10 },
      "baseMass": 340,
      "structure": 420,
      "crewCapacity": 52,
      "baseFuel": 220,
      "buildRecipe": { "hull_frames": 6, "alloys": 10, "life_support": 3 },
      "buildDays": 30,
      "tech": "hull_heavy_freighter"
    },
    {
      "id": "colony_ship",
      "name": "Колониальный транспорт",
      "tier": 2,
      "class": "civilian",
      "phase": 1,
      "slots": { "weapon": 0, "defense": 2, "propulsion": 3, "utility": 8 },
      "baseMass": 380,
      "structure": 460,
      "crewCapacity": 60,
      "baseFuel": 260,
      "buildRecipe": { "hull_frames": 6, "alloys": 12, "life_support": 6 },
      "buildDays": 34,
      "tech": "colonization"
    },
    {
      "id": "cruiser",
      "name": "Крейсер",
      "tier": 3,
      "class": "warship",
      "phase": 1,
      "slots": { "weapon": 5, "defense": 4, "propulsion": 3, "utility": 3 },
      "baseMass": 290,
      "structure": 600,
      "crewCapacity": 105,
      "baseFuel": 180,
      "buildRecipe": { "hull_frames": 8, "alloys": 18, "life_support": 3 },
      "buildDays": 40,
      "tech": "hull_cruiser"
    },
    {
      "id": "troopship",
      "name": "Десантный транспорт",
      "tier": 3,
      "class": "support",
      "phase": 1,
      "slots": { "weapon": 1, "defense": 3, "propulsion": 3, "utility": 7 },
      "baseMass": 400,
      "structure": 520,
      "crewCapacity": 80,
      "baseFuel": 200,
      "buildRecipe": { "hull_frames": 7, "alloys": 14, "life_support": 4 },
      "buildDays": 34,
      "tech": "planetary_assault"
    },
    {
      "id": "battleship",
      "name": "Линкор",
      "tier": 4,
      "class": "warship",
      "phase": 1,
      "slots": { "weapon": 8, "defense": 6, "propulsion": 4, "utility": 4 },
      "baseMass": 620,
      "structure": 1350,
      "crewCapacity": 230,
      "baseFuel": 300,
      "buildRecipe": { "hull_frames": 14, "alloys": 34, "life_support": 5 },
      "buildDays": 65,
      "tech": "hull_battleship"
    },
    {
      "id": "dreadnought",
      "name": "Дредноут",
      "tier": 5,
      "class": "warship",
      "phase": 2,
      "slots": { "weapon": 12, "defense": 9, "propulsion": 5, "utility": 6 },
      "baseMass": 1180,
      "structure": 2700,
      "crewCapacity": 460,
      "baseFuel": 460,
      "buildRecipe": { "hull_frames": 24, "alloys": 60, "life_support": 8 },
      "buildDays": 110,
      "tech": "hull_dreadnought"
    }
  ]
}
